{
  "$schema": "http://json-schema.org/draft-07/schema#",
  "$id": "handoff.schema.json",
  "title": "Handoff object (Chapter 8.5)",
  "description": "What one subagent hands to the next: the target, a summary of completed work, the artifact references that support it, and any unresolved questions. Deliberately compact — never a full conversational transcript.",
  "type": "object",
  "additionalProperties": false,
  "required": ["target", "completed_work", "supporting_artifacts", "unresolved_questions"],
  "properties": {
    "target": {
      "description": "The agent, subagent, or workflow stage receiving this handoff.",
      "type": "string",
      "minLength": 1
    },
    "completed_work": {
      "description": "One-sentence summary of what was done, not a transcript of how.",
      "type": "string",
      "minLength": 1
    },
    "supporting_artifacts": {
      "description": "References the receiving party can look up directly — evidence_ids, signal_ids, hypothesis_ids, or output file paths — never inlined full content.",
      "type": "array",
      "items": { "type": "string", "minLength": 1 }
    },
    "unresolved_questions": {
      "description": "Anything the sending agent could not confirm or resolve, including unresolved conflicting-evidence pairs (Ch. 7.5). An empty array means genuinely none, not an unreported gap.",
      "type": "array",
      "items": { "type": "string", "minLength": 1 }
    }
  }
}
